{
  "$schema": "../vps-health-status.schema.json",
  "record_id": "vhs-degraded01",
  "schema_family": "vps_health_status",
  "vps_id": "vps-prod-01",
  "vps_name": "Production VPS",
  "overall_status": "critical",
  "system_metrics": {
    "cpu_percent": 92.5,
    "memory_percent": 88.7,
    "disk_percent": 75.0,
    "uptime_seconds": 3600,
    "load_average": [8.5, 7.2, 6.1],
    "network_in_bytes": 524288000,
    "network_out_bytes": 262144000
  },
  "kin_summary": {
    "active_kin_count": 5,
    "total_kin_count": 6,
    "healthy_count": 3,
    "unhealthy_count": 2,
    "unknown_count": 1
  },
  "alerts": [
    {
      "alert_id": "alert-cpu-high",
      "severity": "critical",
      "message": "High CPU usage: 92.5%",
      "timestamp": "2024-01-15T10:30:00.000Z"
    },
    {
      "alert_id": "alert-mem-high",
      "severity": "warning",
      "message": "High memory usage: 88.7%",
      "timestamp": "2024-01-15T10:30:00.000Z"
    },
    {
      "alert_id": "alert-kin-vortex",
      "severity": "critical",
      "message": "Kin vortex-001 is unhealthy: Connection timeout",
      "timestamp": "2024-01-15T10:30:00.000Z"
    },
    {
      "alert_id": "alert-kin-forge",
      "severity": "warning",
      "message": "Kin forge-001 is unhealthy: Service unavailable",
      "timestamp": "2024-01-15T10:30:00.000Z"
    }
  ],
  "last_check_timestamp": "2024-01-15T10:30:00.000Z",
  "created_at": "2024-01-15T10:30:00.000Z",
  "schema_version": "1.0.0"
}
